{
  "away_score": 0,
  "away_team": "ATL",
  "div_game": true,
  "game_id": "2025_03_ATL_CAR",
  "home_score": 30,
  "home_team": "CAR",
  "key_injuries": [
    {
      "gsis_id": "00-0033572",
      "name": "Jamal Agnew",
      "primary_injury": "Groin",
      "status": "Out",
      "team": "ATL"
    },
    {
      "gsis_id": "00-0034639",
      "name": "Mike Ford",
      "primary_injury": "Groin",
      "status": "Questionable",
      "team": "ATL"
    },
    {
      "gsis_id": "00-0036285",
      "name": "A.J. Terrell",
      "primary_injury": "Hamstring",
      "status": "Out",
      "team": "ATL"
    },
    {
      "gsis_id": "00-0039394",
      "name": "Casey Washington",
      "primary_injury": "Concussion",
      "status": "Out",
      "team": "ATL"
    },
    {
      "gsis_id": "00-0035890",
      "name": "Tershawn Wharton",
      "primary_injury": "Hamstring",
      "status": "Out",
      "team": "CAR"
    },
    {
      "gsis_id": "00-0037007",
      "name": "Patrick Jones II",
      "primary_injury": "Hamstring",
      "status": "Out",
      "team": "CAR"
    },
    {
      "gsis_id": "00-0039342",
      "name": "Xavier Legette",
      "primary_injury": "Hamstring",
      "status": "Questionable",
      "team": "CAR"
    }
  ],
  "kickoff": "13:00",
  "rest_days": {
    "away": 7,
    "home": 7
  },
  "result": 30,
  "roof": "outdoors",
  "season": 2025,
  "spread_line": -5.5,
  "stadium": "Bank of America Stadium",
  "stadium_id": "CAR00",
  "starting_qbs": {
    "away": "00-0039917",
    "home": "00-0039150"
  },
  "surface": "grass",
  "team_stats": {
    "ATL": {
      "passing_epa": -21.848133884173095,
      "passing_tds": 0,
      "passing_yards": 201,
      "receiving_epa": -20.450830615859687,
      "rushing_epa": -0.5324786291457713,
      "rushing_tds": 0,
      "rushing_yards": 131
    },
    "CAR": {
      "passing_epa": -2.4837949486153077,
      "passing_tds": 0,
      "passing_yards": 121,
      "receiving_epa": -0.30790516077214525,
      "rushing_epa": 2.0001413919962943,
      "rushing_tds": 2,
      "rushing_yards": 110
    }
  },
  "temp": 83,
  "total_line": 44.5,
  "week": 3,
  "wind": 5
}
