{
  "away_score": 13,
  "away_team": "SEA",
  "div_game": true,
  "game_id": "2025_18_SEA_SF",
  "home_score": 3,
  "home_team": "SF",
  "key_injuries": [
    {
      "gsis_id": "00-0036363",
      "name": "Josh Jones",
      "primary_injury": "Ankle",
      "status": "Questionable",
      "team": "SEA"
    },
    {
      "gsis_id": "00-0037821",
      "name": "Charles Cross",
      "primary_injury": "Hamstring",
      "status": "Out",
      "team": "SEA"
    },
    {
      "gsis_id": "00-0038136",
      "name": "Coby Bryant",
      "primary_injury": "Knee",
      "status": "Doubtful",
      "team": "SEA"
    },
    {
      "gsis_id": "00-0027857",
      "name": "Trent Williams",
      "primary_injury": "Hamstring",
      "status": "Questionable",
      "team": "SF"
    },
    {
      "gsis_id": "00-0033288",
      "name": "George Kittle",
      "primary_injury": "Ankle",
      "status": "Questionable",
      "team": "SF"
    },
    {
      "gsis_id": "00-0039148",
      "name": "Keion White",
      "primary_injury": "Groin",
      "status": "Questionable",
      "team": "SF"
    },
    {
      "gsis_id": "00-0039916",
      "name": "Ricky Pearsall",
      "primary_injury": "Knee",
      "status": "Questionable",
      "team": "SF"
    },
    {
      "gsis_id": "00-0040152",
      "name": "Upton Stout",
      "primary_injury": "Concussion",
      "status": "Questionable",
      "team": "SF"
    }
  ],
  "kickoff": "20:00",
  "rest_days": {
    "away": 6,
    "home": 6
  },
  "result": -10,
  "roof": "outdoors",
  "season": 2025,
  "spread_line": -2.5,
  "stadium": "Levi's Stadium",
  "stadium_id": "SFO01",
  "starting_qbs": {
    "away": "00-0034869",
    "home": "00-0037834"
  },
  "surface": "grass",
  "team_stats": {
    "SEA": {
      "passing_epa": 4.779637816391724,
      "passing_tds": 0,
      "passing_yards": 198,
      "receiving_epa": 7.542190313601705,
      "rushing_epa": -2.5733388290391304,
      "rushing_tds": 1,
      "rushing_yards": 180
    },
    "SF": {
      "passing_epa": -13.559072515919308,
      "passing_tds": 0,
      "passing_yards": 127,
      "receiving_epa": -10.090729126241058,
      "rushing_epa": -1.5185369324171916,
      "rushing_tds": 0,
      "rushing_yards": 53
    }
  },
  "temp": 57,
  "total_line": 47.5,
  "week": 18,
  "wind": 8
}
