{
  "away_score": 45,
  "away_team": "CIN",
  "div_game": false,
  "game_id": "2025_16_CIN_MIA",
  "home_score": 21,
  "home_team": "MIA",
  "key_injuries": [
    {
      "gsis_id": "00-0034800",
      "name": "B.J. Hill",
      "primary_injury": "Ankle",
      "status": "Questionable",
      "team": "CIN"
    },
    {
      "gsis_id": "00-0035644",
      "name": "Noah Fant",
      "primary_injury": "Ankle",
      "status": "Out",
      "team": "CIN"
    },
    {
      "gsis_id": "00-0036410",
      "name": "Tee Higgins",
      "primary_injury": "Concussion",
      "status": "Questionable",
      "team": "CIN"
    },
    {
      "gsis_id": "00-0036902",
      "name": "Joseph Ossai",
      "primary_injury": "Ankle",
      "status": "Out",
      "team": "CIN"
    },
    {
      "gsis_id": "00-0038549",
      "name": "DJ Turner II",
      "primary_injury": "Illness",
      "status": "Questionable",
      "team": "CIN"
    },
    {
      "gsis_id": "00-0038576",
      "name": "Charlie Jones",
      "primary_injury": "Ankle",
      "status": "Out",
      "team": "CIN"
    },
    {
      "gsis_id": "00-0039632",
      "name": "PJ Jules",
      "primary_injury": "Ankle",
      "status": "Questionable",
      "team": "CIN"
    },
    {
      "gsis_id": "00-0034248",
      "name": "Elijah Campbell",
      "primary_injury": "Ankle",
      "status": "Questionable",
      "team": "MIA"
    },
    {
      "gsis_id": "00-0034789",
      "name": "Minkah Fitzpatrick",
      "primary_injury": "Calf",
      "status": "Out",
      "team": "MIA"
    },
    {
      "gsis_id": "00-0034794",
      "name": "Jason Sanders",
      "primary_injury": "Hip",
      "status": "Out",
      "team": "MIA"
    },
    {
      "gsis_id": "00-0036409",
      "name": "Jordyn Brooks",
      "primary_injury": "Foot",
      "status": "Questionable",
      "team": "MIA"
    },
    {
      "gsis_id": "00-0039483",
      "name": "Isaiah Johnson",
      "primary_injury": "Knee",
      "status": "Questionable",
      "team": "MIA"
    },
    {
      "gsis_id": "00-0039485",
      "name": "Andrew Meyer",
      "primary_injury": "Triceps",
      "status": "Out",
      "team": "MIA"
    }
  ],
  "kickoff": "13:00",
  "rest_days": {
    "away": 7,
    "home": 6
  },
  "result": -24,
  "roof": "outdoors",
  "season": 2025,
  "spread_line": -3.5,
  "stadium": "Hard Rock Stadium",
  "stadium_id": "MIA00",
  "starting_qbs": {
    "away": "00-0036442",
    "home": "00-0040234"
  },
  "surface": "grass",
  "team_stats": {
    "CIN": {
      "passing_epa": 19.599535186017334,
      "passing_tds": 4,
      "passing_yards": 313,
      "receiving_epa": 24.409772875775985,
      "rushing_epa": 3.1018528166459873,
      "rushing_tds": 2,
      "rushing_yards": 105
    },
    "MIA": {
      "passing_epa": 4.669538128830027,
      "passing_tds": 0,
      "passing_yards": 260,
      "receiving_epa": 2.240813699492719,
      "rushing_epa": -4.7002626050962135,
      "rushing_tds": 3,
      "rushing_yards": 129
    }
  },
  "temp": 81,
  "total_line": 48.5,
  "week": 16,
  "wind": 7
}
