{
  "away_score": 28,
  "away_team": "BAL",
  "div_game": false,
  "game_id": "2025_09_BAL_MIA",
  "home_score": 6,
  "home_team": "MIA",
  "key_injuries": [
    {
      "gsis_id": "00-0034832",
      "name": "Bradley Chubb",
      "primary_injury": "Shoulder",
      "status": "Questionable",
      "team": "MIA"
    },
    {
      "gsis_id": "00-0036329",
      "name": "Ashtyn Davis",
      "primary_injury": "Quadricep",
      "status": "Doubtful",
      "team": "MIA"
    },
    {
      "gsis_id": "00-0036620",
      "name": "Dee Eskridge",
      "primary_injury": "Shoulder",
      "status": "Questionable",
      "team": "MIA"
    },
    {
      "gsis_id": "00-0036993",
      "name": "Ifeatu Melifonwu",
      "primary_injury": "Thumb",
      "status": "Questionable",
      "team": "MIA"
    },
    {
      "gsis_id": "00-0038720",
      "name": "Julian Hill",
      "primary_injury": "Ankle",
      "status": "Out",
      "team": "MIA"
    },
    {
      "gsis_id": "00-0040178",
      "name": "Jason Marshall Jr.",
      "primary_injury": "Hamstring",
      "status": "Questionable",
      "team": "MIA"
    }
  ],
  "kickoff": "20:15",
  "rest_days": {
    "away": 4,
    "home": 4
  },
  "result": -22,
  "roof": "outdoors",
  "season": 2025,
  "spread_line": -7.5,
  "stadium": "Hard Rock Stadium",
  "stadium_id": "MIA00",
  "starting_qbs": {
    "away": "00-0034796",
    "home": "00-0036212"
  },
  "surface": "grass",
  "team_stats": {
    "BAL": {
      "passing_epa": 10.401708490913734,
      "passing_tds": 4,
      "passing_yards": 204,
      "receiving_epa": 13.562464855145663,
      "rushing_epa": -0.9445660525234416,
      "rushing_tds": 0,
      "rushing_yards": 150
    },
    "MIA": {
      "passing_epa": 3.5116250164788205,
      "passing_tds": 0,
      "passing_yards": 261,
      "receiving_epa": 1.845194312736158,
      "rushing_epa": -9.570615272136596,
      "rushing_tds": 0,
      "rushing_yards": 87
    }
  },
  "temp": 73,
  "total_line": 51.5,
  "week": 9,
  "wind": 5
}
