{
  "away_score": 37,
  "away_team": "SEA",
  "div_game": false,
  "game_id": "2025_14_SEA_ATL",
  "home_score": 9,
  "home_team": "ATL",
  "key_injuries": [
    {
      "gsis_id": "00-0033051",
      "name": "David Onyemata",
      "primary_injury": "Foot",
      "status": "Questionable",
      "team": "ATL"
    },
    {
      "gsis_id": "00-0037238",
      "name": "Drake London",
      "primary_injury": "Knee",
      "status": "Out",
      "team": "ATL"
    },
    {
      "gsis_id": "00-0038628",
      "name": "DeMarcco Hellams",
      "primary_injury": "Hamstring",
      "status": "Out",
      "team": "ATL"
    },
    {
      "gsis_id": "00-0039859",
      "name": "Brandon Dorlus",
      "primary_injury": "Groin",
      "status": "Out",
      "team": "ATL"
    },
    {
      "gsis_id": "00-0040578",
      "name": "James Pearce Jr.",
      "primary_injury": "Back",
      "status": "Questionable",
      "team": "ATL"
    },
    {
      "gsis_id": "00-0037093",
      "name": "Dareke Young",
      "primary_injury": "Quadricep",
      "status": "Out",
      "team": "SEA"
    },
    {
      "gsis_id": "00-0040647",
      "name": "Rylie Mills",
      "primary_injury": "Knee",
      "status": "Out",
      "team": "SEA"
    }
  ],
  "kickoff": "13:00",
  "rest_days": {
    "away": 7,
    "home": 7
  },
  "result": -28,
  "roof": "closed",
  "season": 2025,
  "spread_line": -7.0,
  "stadium": "Mercedes-Benz Stadium",
  "stadium_id": "ATL97",
  "starting_qbs": {
    "away": "00-0034869",
    "home": "00-0029604"
  },
  "surface": "fieldturf",
  "team_stats": {
    "ATL": {
      "passing_epa": -15.373345657525775,
      "passing_tds": 0,
      "passing_yards": 162,
      "receiving_epa": -12.151348858297993,
      "rushing_epa": -6.699612575408537,
      "rushing_tds": 0,
      "rushing_yards": 120
    },
    "SEA": {
      "passing_epa": 10.041374834340722,
      "passing_tds": 3,
      "passing_yards": 249,
      "receiving_epa": 13.082453788810135,
      "rushing_epa": -1.2361699429457076,
      "rushing_tds": 0,
      "rushing_yards": 129
    }
  },
  "temp": null,
  "total_line": 44.5,
  "week": 14,
  "wind": null
}
