{
  "away_score": 30,
  "away_team": "BUF",
  "div_game": false,
  "game_id": "2025_20_BUF_DEN",
  "home_score": 33,
  "home_team": "DEN",
  "key_injuries": [
    {
      "gsis_id": "00-0030114",
      "name": "Jordan Poyer",
      "primary_injury": "Hamstring",
      "status": "Out",
      "team": "BUF"
    },
    {
      "gsis_id": "00-0033282",
      "name": "Curtis Samuel",
      "primary_injury": "Elbow",
      "status": "Questionable",
      "team": "BUF"
    },
    {
      "gsis_id": "00-0035230",
      "name": "Ed Oliver",
      "primary_injury": "Biceps",
      "status": "Questionable",
      "team": "BUF"
    },
    {
      "gsis_id": "00-0035537",
      "name": "Ty Johnson",
      "primary_injury": "Ankle",
      "status": "Questionable",
      "team": "BUF"
    },
    {
      "gsis_id": "00-0036888",
      "name": "Damar Hamlin",
      "primary_injury": "Pectoral",
      "status": "Questionable",
      "team": "BUF"
    },
    {
      "gsis_id": "00-0037254",
      "name": "Terrel Bernard",
      "primary_injury": "Calf",
      "status": "Questionable",
      "team": "BUF"
    },
    {
      "gsis_id": "00-0038679",
      "name": "Tyrell Shavers",
      "primary_injury": "Knee",
      "status": "Out",
      "team": "BUF"
    },
    {
      "gsis_id": "00-0040709",
      "name": "Maxwell Hairston",
      "primary_injury": "Ankle",
      "status": "Out",
      "team": "BUF"
    },
    {
      "gsis_id": "00-0037539",
      "name": "Lucas Krull",
      "primary_injury": "Foot",
      "status": "Out",
      "team": "DEN"
    },
    {
      "gsis_id": "00-0039003",
      "name": "Drew Sanders",
      "primary_injury": "Ankle",
      "status": "Out",
      "team": "DEN"
    }
  ],
  "kickoff": "16:30",
  "rest_days": {
    "away": 6,
    "home": 13
  },
  "result": 3,
  "roof": "outdoors",
  "season": 2025,
  "spread_line": 1.5,
  "stadium": "Empower Field at Mile High",
  "stadium_id": "DEN00",
  "starting_qbs": {
    "away": "00-0034857",
    "home": "00-0039732"
  },
  "surface": "grass",
  "team_stats": {
    "BUF": {
      "passing_epa": 4.9573255149145075,
      "passing_tds": 3,
      "passing_yards": 283,
      "receiving_epa": 12.418457170758437,
      "rushing_epa": 1.584455007529633,
      "rushing_tds": 0,
      "rushing_yards": 183
    },
    "DEN": {
      "passing_epa": 3.462618759378192,
      "passing_tds": 3,
      "passing_yards": 279,
      "receiving_epa": 5.367867949633027,
      "rushing_epa": -3.2232795037844446,
      "rushing_tds": 0,
      "rushing_yards": 70
    }
  },
  "temp": 36,
  "total_line": 45.5,
  "week": 20,
  "wind": 5
}
