{
  "away_score": 34,
  "away_team": "SF",
  "div_game": false,
  "game_id": "2025_09_SF_NYG",
  "home_score": 24,
  "home_team": "NYG",
  "key_injuries": [
    {
      "gsis_id": "00-0033290",
      "name": "Jermaine Eluemunor",
      "primary_injury": "Pectoral",
      "status": "Doubtful",
      "team": "NYG"
    },
    {
      "gsis_id": "00-0036937",
      "name": "Paulson Adebo",
      "primary_injury": "Knee",
      "status": "Out",
      "team": "NYG"
    },
    {
      "gsis_id": "00-0036982",
      "name": "Chauncey Golston",
      "primary_injury": "Neck",
      "status": "Out",
      "team": "NYG"
    },
    {
      "gsis_id": "00-0036998",
      "name": "Jevon Holland",
      "primary_injury": "Knee",
      "status": "Questionable",
      "team": "NYG"
    },
    {
      "gsis_id": "00-0037758",
      "name": "Cordale Flott",
      "primary_injury": "Concussion",
      "status": "Out",
      "team": "NYG"
    },
    {
      "gsis_id": "00-0038115",
      "name": "Daniel Bellinger",
      "primary_injury": "Neck",
      "status": "Doubtful",
      "team": "NYG"
    },
    {
      "gsis_id": "00-0038788",
      "name": "Art Green",
      "primary_injury": "Hamstring",
      "status": "Out",
      "team": "NYG"
    },
    {
      "gsis_id": "00-0039620",
      "name": "Rico Payton",
      "primary_injury": "Groin",
      "status": "Questionable",
      "team": "NYG"
    },
    {
      "gsis_id": "00-0032701",
      "name": "Jake Brendel",
      "primary_injury": "Hamstring",
      "status": "Out",
      "team": "SF"
    },
    {
      "gsis_id": "00-0036151",
      "name": "Bryce Huff",
      "primary_injury": "Hamstring",
      "status": "Out",
      "team": "SF"
    },
    {
      "gsis_id": "00-0036266",
      "name": "Jordan Elliott",
      "primary_injury": "Ankle",
      "status": "Questionable",
      "team": "SF"
    },
    {
      "gsis_id": "00-0036272",
      "name": "Ben Bartch",
      "primary_injury": "Ankle",
      "status": "Questionable",
      "team": "SF"
    },
    {
      "gsis_id": "00-0036288",
      "name": "Yetur Gross-Matos",
      "primary_injury": "Knee",
      "status": "Out",
      "team": "SF"
    },
    {
      "gsis_id": "00-0037602",
      "name": "Sam Okuayinonu",
      "primary_injury": "Ankle",
      "status": "Questionable",
      "team": "SF"
    },
    {
      "gsis_id": "00-0037829",
      "name": "Spencer Burford",
      "primary_injury": "Knee",
      "status": "Questionable",
      "team": "SF"
    },
    {
      "gsis_id": "00-0037834",
      "name": "Brock Purdy",
      "primary_injury": "Toe",
      "status": "Questionable",
      "team": "SF"
    },
    {
      "gsis_id": "00-0038625",
      "name": "Dee Winters",
      "primary_injury": "Knee",
      "status": "Questionable",
      "team": "SF"
    },
    {
      "gsis_id": "00-0039916",
      "name": "Ricky Pearsall",
      "primary_injury": "Knee",
      "status": "Out",
      "team": "SF"
    }
  ],
  "kickoff": "13:00",
  "rest_days": {
    "away": 7,
    "home": 7
  },
  "result": -10,
  "roof": "outdoors",
  "season": 2025,
  "spread_line": -2.5,
  "stadium": "MetLife Stadium",
  "stadium_id": "NYC01",
  "starting_qbs": {
    "away": "00-0036972",
    "home": "00-0040691"
  },
  "surface": "fieldturf",
  "team_stats": {
    "NYG": {
      "passing_epa": 1.7102711593444475,
      "passing_tds": 2,
      "passing_yards": 191,
      "receiving_epa": 4.40916444493374,
      "rushing_epa": 7.818000182276592,
      "rushing_tds": 1,
      "rushing_yards": 117
    },
    "SF": {
      "passing_epa": 13.49070095318574,
      "passing_tds": 2,
      "passing_yards": 235,
      "receiving_epa": 17.54056456459192,
      "rushing_epa": 4.97246976243332,
      "rushing_tds": 2,
      "rushing_yards": 159
    }
  },
  "temp": 56,
  "total_line": 47.5,
  "week": 9,
  "wind": 5
}
