{
  "away_score": 39,
  "away_team": "NYJ",
  "div_game": false,
  "game_id": "2025_08_NYJ_CIN",
  "home_score": 38,
  "home_team": "CIN",
  "key_injuries": [
    {
      "gsis_id": "00-0033935",
      "name": "Trey Hendrickson",
      "primary_injury": "Hip",
      "status": "Questionable",
      "team": "CIN"
    },
    {
      "gsis_id": "00-0036850",
      "name": "Cameron Sample",
      "primary_injury": "Knee",
      "status": "Doubtful",
      "team": "CIN"
    },
    {
      "gsis_id": "00-0036884",
      "name": "Marco Wilson",
      "primary_injury": "Hamstring",
      "status": "Doubtful",
      "team": "CIN"
    },
    {
      "gsis_id": "00-0039426",
      "name": "Matt Lee",
      "primary_injury": "Knee",
      "status": "Doubtful",
      "team": "CIN"
    },
    {
      "gsis_id": "00-0039752",
      "name": "Cedric Johnson",
      "primary_injury": "Calf",
      "status": "Out",
      "team": "CIN"
    },
    {
      "gsis_id": "00-0028118",
      "name": "Tyrod Taylor",
      "primary_injury": "Knee",
      "status": "Out",
      "team": "NYJ"
    },
    {
      "gsis_id": "00-0033943",
      "name": "Josh Reynolds",
      "primary_injury": "Hip",
      "status": "Out",
      "team": "NYJ"
    },
    {
      "gsis_id": "00-0035680",
      "name": "Quincy Williams",
      "primary_injury": "Shoulder",
      "status": "Questionable",
      "team": "NYJ"
    },
    {
      "gsis_id": "00-0036842",
      "name": "Kene Nwangwu",
      "primary_injury": "Concussion",
      "status": "Out",
      "team": "NYJ"
    },
    {
      "gsis_id": "00-0036881",
      "name": "Jay Tufele",
      "primary_injury": "Knee",
      "status": "Out",
      "team": "NYJ"
    },
    {
      "gsis_id": "00-0037190",
      "name": "Sauce Gardner",
      "primary_injury": "Concussion",
      "status": "Out",
      "team": "NYJ"
    },
    {
      "gsis_id": "00-0037475",
      "name": "Stone Smartt",
      "primary_injury": "Quadricep",
      "status": "Out",
      "team": "NYJ"
    },
    {
      "gsis_id": "00-0037740",
      "name": "Garrett Wilson",
      "primary_injury": "Knee",
      "status": "Out",
      "team": "NYJ"
    },
    {
      "gsis_id": "00-0038120",
      "name": "Breece Hall",
      "primary_injury": "Knee",
      "status": "Questionable",
      "team": "NYJ"
    },
    {
      "gsis_id": "00-0038513",
      "name": "Cam Jones",
      "primary_injury": "Hip",
      "status": "Out",
      "team": "NYJ"
    },
    {
      "gsis_id": "00-0040736",
      "name": "Mason Taylor",
      "primary_injury": "Quadricep",
      "status": "Questionable",
      "team": "NYJ"
    }
  ],
  "kickoff": "13:00",
  "rest_days": {
    "away": 7,
    "home": 10
  },
  "result": -1,
  "roof": "outdoors",
  "season": 2025,
  "spread_line": 5.5,
  "stadium": "Paycor Stadium",
  "stadium_id": "CIN00",
  "starting_qbs": {
    "away": "00-0036945",
    "home": "00-0026158"
  },
  "surface": "fieldturf",
  "team_stats": {
    "CIN": {
      "passing_epa": 3.1859004099274553,
      "passing_tds": 2,
      "passing_yards": 223,
      "receiving_epa": 6.399961093196509,
      "rushing_epa": 12.15586738823913,
      "rushing_tds": 3,
      "rushing_yards": 181
    },
    "NYJ": {
      "passing_epa": 16.242679117939325,
      "passing_tds": 2,
      "passing_yards": 248,
      "receiving_epa": 19.241507287829073,
      "rushing_epa": 5.550307312261005,
      "rushing_tds": 2,
      "rushing_yards": 254
    }
  },
  "temp": 57,
  "total_line": 43.5,
  "week": 8,
  "wind": 8
}
