{
  "away_score": 20,
  "away_team": "CLE",
  "div_game": true,
  "game_id": "2025_18_CLE_CIN",
  "home_score": 18,
  "home_team": "CIN",
  "key_injuries": [
    {
      "gsis_id": "00-0034800",
      "name": "B.J. Hill",
      "primary_injury": "Ankle",
      "status": "Questionable",
      "team": "CIN"
    },
    {
      "gsis_id": "00-0036902",
      "name": "Joseph Ossai",
      "primary_injury": "Ankle",
      "status": "Out",
      "team": "CIN"
    },
    {
      "gsis_id": "00-0038576",
      "name": "Charlie Jones",
      "primary_injury": "Ankle",
      "status": "Out",
      "team": "CIN"
    },
    {
      "gsis_id": "00-0039375",
      "name": "Josh Newton",
      "primary_injury": "Hamstring",
      "status": "Out",
      "team": "CIN"
    },
    {
      "gsis_id": "00-0039426",
      "name": "Matt Lee",
      "primary_injury": "Knee",
      "status": "Out",
      "team": "CIN"
    },
    {
      "gsis_id": "00-0039631",
      "name": "Cam Grandy",
      "primary_injury": "Chest",
      "status": "Questionable",
      "team": "CIN"
    },
    {
      "gsis_id": "00-0033885",
      "name": "David Njoku",
      "primary_injury": "Knee",
      "status": "Out",
      "team": "CLE"
    },
    {
      "gsis_id": "00-0039417",
      "name": "Myles Harden",
      "primary_injury": "Shoulder",
      "status": "Questionable",
      "team": "CLE"
    },
    {
      "gsis_id": "00-0039442",
      "name": "Kingsley Eguakun",
      "primary_injury": "Knee",
      "status": "Questionable",
      "team": "CLE"
    },
    {
      "gsis_id": "00-0039515",
      "name": "Winston Reid",
      "primary_injury": "Back",
      "status": "Out",
      "team": "CLE"
    },
    {
      "gsis_id": "00-0040579",
      "name": "Carson Schwesinger",
      "primary_injury": "Ankle",
      "status": "Out",
      "team": "CLE"
    },
    {
      "gsis_id": "00-0040663",
      "name": "Harold Fannin Jr.",
      "primary_injury": "Groin",
      "status": "Out",
      "team": "CLE"
    }
  ],
  "kickoff": "13:00",
  "rest_days": {
    "away": 7,
    "home": 7
  },
  "result": -2,
  "roof": "outdoors",
  "season": 2025,
  "spread_line": 9.5,
  "stadium": "Paycor Stadium",
  "stadium_id": "CIN00",
  "starting_qbs": {
    "away": "00-0040668",
    "home": "00-0036442"
  },
  "surface": "fieldturf",
  "team_stats": {
    "CIN": {
      "passing_epa": -3.44213337778626,
      "passing_tds": 3,
      "passing_yards": 236,
      "receiving_epa": -9.044416864766273,
      "rushing_epa": 4.8978716064593755,
      "rushing_tds": 0,
      "rushing_yards": 142
    },
    "CLE": {
      "passing_epa": -9.697163290788161,
      "passing_tds": 0,
      "passing_yards": 111,
      "receiving_epa": 0.7055347196292132,
      "rushing_epa": 3.1764441761446536,
      "rushing_tds": 0,
      "rushing_yards": 118
    }
  },
  "temp": 37,
  "total_line": 47.5,
  "week": 18,
  "wind": 0
}
