{
  "away_score": 20,
  "away_team": "PHI",
  "div_game": false,
  "game_id": "2025_02_PHI_KC",
  "home_score": 17,
  "home_team": "KC",
  "key_injuries": [
    {
      "gsis_id": "00-0039894",
      "name": "Xavier Worthy",
      "primary_injury": "Shoulder",
      "status": "Out",
      "team": "KC"
    },
    {
      "gsis_id": "00-0040646",
      "name": "Jalen Royals",
      "primary_injury": "Knee",
      "status": "Out",
      "team": "KC"
    },
    {
      "gsis_id": "00-0034351",
      "name": "Dallas Goedert",
      "primary_injury": "Knee",
      "status": "Out",
      "team": "PHI"
    },
    {
      "gsis_id": "00-0038400",
      "name": "Tanner McKee",
      "primary_injury": "Thumb",
      "status": "Questionable",
      "team": "PHI"
    },
    {
      "gsis_id": "00-0039746",
      "name": "Will Shipley",
      "primary_injury": "Oblique",
      "status": "Out",
      "team": "PHI"
    },
    {
      "gsis_id": "00-0040687",
      "name": "Cameron Williams",
      "primary_injury": "Shoulder",
      "status": "Out",
      "team": "PHI"
    }
  ],
  "kickoff": "16:25",
  "rest_days": {
    "away": 10,
    "home": 9
  },
  "result": -3,
  "roof": "outdoors",
  "season": 2025,
  "spread_line": -1.5,
  "stadium": "GEHA Field at Arrowhead Stadium",
  "stadium_id": "KAN00",
  "starting_qbs": {
    "away": "00-0036389",
    "home": "00-0033873"
  },
  "surface": "grass",
  "team_stats": {
    "KC": {
      "passing_epa": -7.1535654113225045,
      "passing_tds": 1,
      "passing_yards": 187,
      "receiving_epa": -3.5375350879039615,
      "rushing_epa": -0.55819323484677,
      "rushing_tds": 1,
      "rushing_yards": 121
    },
    "PHI": {
      "passing_epa": -4.85998605615568,
      "passing_tds": 0,
      "passing_yards": 101,
      "receiving_epa": -2.1610662251372514,
      "rushing_epa": 2.4358081016107462,
      "rushing_tds": 2,
      "rushing_yards": 122
    }
  },
  "temp": 88,
  "total_line": 46.5,
  "week": 2,
  "wind": 12
}
