{
  "away_score": 17,
  "away_team": "DET",
  "div_game": false,
  "game_id": "2025_06_DET_KC",
  "home_score": 30,
  "home_team": "KC",
  "key_injuries": [
    {
      "gsis_id": "00-0032381",
      "name": "Taylor Decker",
      "primary_injury": "Shoulder",
      "status": "Out",
      "team": "DET"
    },
    {
      "gsis_id": "00-0032464",
      "name": "Kalif Raymond",
      "primary_injury": "Neck",
      "status": "Questionable",
      "team": "DET"
    },
    {
      "gsis_id": "00-0033547",
      "name": "Zach Cunningham",
      "primary_injury": "Hamstring",
      "status": "Out",
      "team": "DET"
    },
    {
      "gsis_id": "00-0034377",
      "name": "Avonte Maddox",
      "primary_injury": "Hamstring",
      "status": "Out",
      "team": "DET"
    },
    {
      "gsis_id": "00-0036624",
      "name": "Alim McNeill",
      "primary_injury": "Knee",
      "status": "Out",
      "team": "DET"
    },
    {
      "gsis_id": "00-0037667",
      "name": "Kerby Joseph",
      "primary_injury": "Knee",
      "status": "Questionable",
      "team": "DET"
    },
    {
      "gsis_id": "00-0039141",
      "name": "Brian Branch",
      "primary_injury": "Ankle",
      "status": "Questionable",
      "team": "DET"
    },
    {
      "gsis_id": "00-0039362",
      "name": "Giovanni Manu",
      "primary_injury": "Knee",
      "status": "Out",
      "team": "DET"
    },
    {
      "gsis_id": "00-0039364",
      "name": "Sione Vaki",
      "primary_injury": "Groin",
      "status": "Out",
      "team": "DET"
    },
    {
      "gsis_id": "00-0039903",
      "name": "Terrion Arnold",
      "primary_injury": "Shoulder",
      "status": "Out",
      "team": "DET"
    },
    {
      "gsis_id": "00-0040116",
      "name": "Josh Simmons",
      "primary_injury": "Not injury related - personal matter",
      "status": "Questionable",
      "team": "KC"
    }
  ],
  "kickoff": "20:20",
  "rest_days": {
    "away": 7,
    "home": 6
  },
  "result": 13,
  "roof": "outdoors",
  "season": 2025,
  "spread_line": 2.5,
  "stadium": "GEHA Field at Arrowhead Stadium",
  "stadium_id": "KAN00",
  "starting_qbs": {
    "away": "00-0033106",
    "home": "00-0033873"
  },
  "surface": "grass",
  "team_stats": {
    "DET": {
      "passing_epa": 6.713151381118223,
      "passing_tds": 2,
      "passing_yards": 203,
      "receiving_epa": 9.188927660870831,
      "rushing_epa": -0.7599178904783912,
      "rushing_tds": 0,
      "rushing_yards": 98
    },
    "KC": {
      "passing_epa": 15.57258388680734,
      "passing_tds": 3,
      "passing_yards": 257,
      "receiving_epa": 20.256762514269212,
      "rushing_epa": -1.6851618335931562,
      "rushing_tds": 1,
      "rushing_yards": 112
    }
  },
  "temp": 85,
  "total_line": 51.5,
  "week": 6,
  "wind": 13
}
