{
  "away_score": 20,
  "away_team": "DEN",
  "div_game": true,
  "game_id": "2025_03_DEN_LAC",
  "home_score": 23,
  "home_team": "LAC",
  "key_injuries": [
    {
      "gsis_id": "00-0033881",
      "name": "Evan Engram",
      "primary_injury": "Back",
      "status": "Out",
      "team": "DEN"
    },
    {
      "gsis_id": "00-0034982",
      "name": "Dre Greenlaw",
      "primary_injury": "Quadricep",
      "status": "Out",
      "team": "DEN"
    },
    {
      "gsis_id": "00-0034159",
      "name": "Will Dissly",
      "primary_injury": "Knee",
      "status": "Out",
      "team": "LAC"
    },
    {
      "gsis_id": "00-0036992",
      "name": "Elijah Molden",
      "primary_injury": "Hamstring",
      "status": "Out",
      "team": "LAC"
    },
    {
      "gsis_id": "00-0038553",
      "name": "Daiyan Henley",
      "primary_injury": "Illness",
      "status": "Questionable",
      "team": "LAC"
    },
    {
      "gsis_id": "00-0039369",
      "name": "Cam Hart",
      "primary_injury": "Hip",
      "status": "Questionable",
      "team": "LAC"
    }
  ],
  "kickoff": "16:05",
  "rest_days": {
    "away": 7,
    "home": 6
  },
  "result": 3,
  "roof": "dome",
  "season": 2025,
  "spread_line": 2.5,
  "stadium": "SoFi Stadium",
  "stadium_id": "LAX01",
  "starting_qbs": {
    "away": "00-0039732",
    "home": "00-0036355"
  },
  "surface": "matrixturf",
  "team_stats": {
    "DEN": {
      "passing_epa": -1.5255322747893847,
      "passing_tds": 1,
      "passing_yards": 153,
      "receiving_epa": 1.4886424657393031,
      "rushing_epa": -0.6456146537093446,
      "rushing_tds": 1,
      "rushing_yards": 118
    },
    "LAC": {
      "passing_epa": -2.3949824955743924,
      "passing_tds": 1,
      "passing_yards": 300,
      "receiving_epa": 8.665200358609557,
      "rushing_epa": -0.69660783782447,
      "rushing_tds": 1,
      "rushing_yards": 106
    }
  },
  "temp": null,
  "total_line": 45.5,
  "week": 3,
  "wind": null
}
