{
  "away_score": 7,
  "away_team": "TEN",
  "div_game": true,
  "game_id": "2025_18_TEN_JAX",
  "home_score": 41,
  "home_team": "JAX",
  "key_injuries": [
    {
      "gsis_id": "00-0035112",
      "name": "Patrick Mekari",
      "primary_injury": "Back",
      "status": "Out",
      "team": "JAX"
    },
    {
      "gsis_id": "00-0040209",
      "name": "Jalen McLeod",
      "primary_injury": "Ankle",
      "status": "Out",
      "team": "JAX"
    },
    {
      "gsis_id": "00-0034825",
      "name": "Arden Key",
      "primary_injury": "Hip",
      "status": "Out",
      "team": "TEN"
    },
    {
      "gsis_id": "00-0035632",
      "name": "Amani Hooker",
      "primary_injury": "Ankle",
      "status": "Doubtful",
      "team": "TEN"
    },
    {
      "gsis_id": "00-0036415",
      "name": "Van Jefferson",
      "primary_injury": "Forearm",
      "status": "Out",
      "team": "TEN"
    },
    {
      "gsis_id": "00-0038119",
      "name": "Jalyn Armour-Davis",
      "primary_injury": "Achilles",
      "status": "Out",
      "team": "TEN"
    },
    {
      "gsis_id": "00-0038724",
      "name": "Ali Gaye",
      "primary_injury": "Knee",
      "status": "Questionable",
      "team": "TEN"
    },
    {
      "gsis_id": "00-0039650",
      "name": "Bryce Oliver",
      "primary_injury": "Knee",
      "status": "Questionable",
      "team": "TEN"
    },
    {
      "gsis_id": "00-0040584",
      "name": "Gunnar Helm",
      "primary_injury": "Toe",
      "status": "Out",
      "team": "TEN"
    },
    {
      "gsis_id": "00-0040752",
      "name": "Oluwafemi Oladejo",
      "primary_injury": "Fibula",
      "status": "Out",
      "team": "TEN"
    }
  ],
  "kickoff": "13:00",
  "rest_days": {
    "away": 7,
    "home": 7
  },
  "result": 34,
  "roof": "outdoors",
  "season": 2025,
  "spread_line": 12.5,
  "stadium": "TIAA Bank Stadium",
  "stadium_id": "JAX00",
  "starting_qbs": {
    "away": "00-0040676",
    "home": "00-0036971"
  },
  "surface": "grass",
  "team_stats": {
    "JAX": {
      "passing_epa": 13.618574522060204,
      "passing_tds": 3,
      "passing_yards": 271,
      "receiving_epa": 18.580697526081327,
      "rushing_epa": -1.5813110442541074,
      "rushing_tds": 1,
      "rushing_yards": 64
    },
    "TEN": {
      "passing_epa": -19.59290128444916,
      "passing_tds": 0,
      "passing_yards": 124,
      "receiving_epa": -18.18064208872736,
      "rushing_epa": 1.1204749886528589,
      "rushing_tds": 1,
      "rushing_yards": 77
    }
  },
  "temp": 55,
  "total_line": 46.5,
  "week": 18,
  "wind": 8
}
