{
  "away_score": 9,
  "away_team": "TB",
  "div_game": false,
  "game_id": "2025_07_TB_DET",
  "home_score": 24,
  "home_team": "DET",
  "key_injuries": [
    {
      "gsis_id": "00-0032381",
      "name": "Taylor Decker",
      "primary_injury": "Shoulder",
      "status": "Questionable",
      "team": "DET"
    },
    {
      "gsis_id": "00-0032424",
      "name": "DJ Reader",
      "primary_injury": "Back",
      "status": "Questionable",
      "team": "DET"
    },
    {
      "gsis_id": "00-0034377",
      "name": "Avonte Maddox",
      "primary_injury": "Hamstring",
      "status": "Out",
      "team": "DET"
    },
    {
      "gsis_id": "00-0036624",
      "name": "Alim McNeill",
      "primary_injury": "Knee",
      "status": "Questionable",
      "team": "DET"
    },
    {
      "gsis_id": "00-0037667",
      "name": "Kerby Joseph",
      "primary_injury": "Knee",
      "status": "Out",
      "team": "DET"
    },
    {
      "gsis_id": "00-0039364",
      "name": "Sione Vaki",
      "primary_injury": "Groin",
      "status": "Out",
      "team": "DET"
    },
    {
      "gsis_id": "00-0039903",
      "name": "Terrion Arnold",
      "primary_injury": "Shoulder",
      "status": "Out",
      "team": "DET"
    },
    {
      "gsis_id": "00-0029562",
      "name": "Lavonte David",
      "primary_injury": "Knee",
      "status": "Questionable",
      "team": "TB"
    },
    {
      "gsis_id": "00-0031237",
      "name": "Teddy Bridgewater",
      "primary_injury": "Illness",
      "status": "Questionable",
      "team": "TB"
    },
    {
      "gsis_id": "00-0031408",
      "name": "Mike Evans",
      "primary_injury": "Hamstring",
      "status": "Questionable",
      "team": "TB"
    },
    {
      "gsis_id": "00-0033921",
      "name": "Chris Godwin Jr.",
      "primary_injury": "Fibula",
      "status": "Out",
      "team": "TB"
    },
    {
      "gsis_id": "00-0038818",
      "name": "Luke Haggard",
      "primary_injury": "Shoulder",
      "status": "Out",
      "team": "TB"
    },
    {
      "gsis_id": "00-0039361",
      "name": "Bucky Irving",
      "primary_injury": "Foot",
      "status": "Out",
      "team": "TB"
    },
    {
      "gsis_id": "00-0040129",
      "name": "Emeka Egbuka",
      "primary_injury": "Hamstring",
      "status": "Questionable",
      "team": "TB"
    },
    {
      "gsis_id": "00-0040429",
      "name": "Josh Williams",
      "primary_injury": "Concussion",
      "status": "Out",
      "team": "TB"
    }
  ],
  "kickoff": "19:00",
  "rest_days": {
    "away": 8,
    "home": 8
  },
  "result": 15,
  "roof": "dome",
  "season": 2025,
  "spread_line": 6.0,
  "stadium": "Ford Field",
  "stadium_id": "DET00",
  "starting_qbs": {
    "away": "00-0034855",
    "home": "00-0033106"
  },
  "surface": "fieldturf",
  "team_stats": {
    "DET": {
      "passing_epa": -8.635040956975383,
      "passing_tds": 1,
      "passing_yards": 241,
      "receiving_epa": 1.6372074593487629,
      "rushing_epa": 0.8147686071461067,
      "rushing_tds": 2,
      "rushing_yards": 164
    },
    "TB": {
      "passing_epa": -25.048290733687832,
      "passing_tds": 1,
      "passing_yards": 228,
      "receiving_epa": -24.802573287600904,
      "rushing_epa": 1.5655925021274015,
      "rushing_tds": 0,
      "rushing_yards": 41
    }
  },
  "temp": null,
  "total_line": 54.5,
  "week": 7,
  "wind": null
}
