{
  "away_score": 16,
  "away_team": "GB",
  "div_game": true,
  "game_id": "2025_16_GB_CHI",
  "home_score": 22,
  "home_team": "CHI",
  "key_injuries": [
    {
      "gsis_id": "00-0034673",
      "name": "Tremaine Edmunds",
      "primary_injury": "Groin",
      "status": "Questionable",
      "team": "CHI"
    },
    {
      "gsis_id": "00-0036275",
      "name": "D'Andre Swift",
      "primary_injury": "Groin",
      "status": "Questionable",
      "team": "CHI"
    },
    {
      "gsis_id": "00-0036290",
      "name": "Cole Kmet",
      "primary_injury": "Ankle",
      "status": "Questionable",
      "team": "CHI"
    },
    {
      "gsis_id": "00-0036716",
      "name": "Amen Ogbongbemiga",
      "primary_injury": "Hamstring",
      "status": "Out",
      "team": "CHI"
    },
    {
      "gsis_id": "00-0036967",
      "name": "Joe Tryon-Shoyinka",
      "primary_injury": "Not injury related - personal matter",
      "status": "Questionable",
      "team": "CHI"
    },
    {
      "gsis_id": "00-0039919",
      "name": "Rome Odunze",
      "primary_injury": "Foot",
      "status": "Out",
      "team": "CHI"
    },
    {
      "gsis_id": "00-0040735",
      "name": "Luther Burden III",
      "primary_injury": "Ankle",
      "status": "Out",
      "team": "CHI"
    },
    {
      "gsis_id": "00-0035700",
      "name": "Josh Jacobs",
      "primary_injury": "Knee",
      "status": "Questionable",
      "team": "GB"
    },
    {
      "gsis_id": "00-0037083",
      "name": "Kingsley Enagbare",
      "primary_injury": "Illness",
      "status": "Questionable",
      "team": "GB"
    },
    {
      "gsis_id": "00-0037194",
      "name": "Darian Kinnard",
      "primary_injury": "Neck",
      "status": "Questionable",
      "team": "GB"
    },
    {
      "gsis_id": "00-0037817",
      "name": "Zach Tom",
      "primary_injury": "Back",
      "status": "Questionable",
      "team": "GB"
    },
    {
      "gsis_id": "00-0038124",
      "name": "Christian Watson",
      "primary_injury": "Chest",
      "status": "Questionable",
      "team": "GB"
    },
    {
      "gsis_id": "00-0038393",
      "name": "Dontayvion Wicks",
      "primary_injury": "Ankle",
      "status": "Questionable",
      "team": "GB"
    },
    {
      "gsis_id": "00-0038463",
      "name": "Brenton Cox Jr.",
      "primary_injury": "Groin",
      "status": "Questionable",
      "team": "GB"
    },
    {
      "gsis_id": "00-0038589",
      "name": "Josh Whyle",
      "primary_injury": "Concussion",
      "status": "Out",
      "team": "GB"
    },
    {
      "gsis_id": "00-0038685",
      "name": "Chris Brooks",
      "primary_injury": "Chest",
      "status": "Questionable",
      "team": "GB"
    },
    {
      "gsis_id": "00-0039811",
      "name": "MarShawn Lloyd",
      "primary_injury": "Calf",
      "status": "Out",
      "team": "GB"
    },
    {
      "gsis_id": "00-0039813",
      "name": "Evan Williams",
      "primary_injury": "Knee",
      "status": "Questionable",
      "team": "GB"
    },
    {
      "gsis_id": "00-0040012",
      "name": "Collin Oliver",
      "primary_injury": "Hamstring",
      "status": "Out",
      "team": "GB"
    },
    {
      "gsis_id": "00-0040023",
      "name": "John Williams",
      "primary_injury": "Back",
      "status": "Out",
      "team": "GB"
    }
  ],
  "kickoff": "20:20",
  "rest_days": {
    "away": 6,
    "home": 6
  },
  "result": 6,
  "roof": "outdoors",
  "season": 2025,
  "spread_line": 1.5,
  "stadium": "Soldier Field",
  "stadium_id": "CHI98",
  "starting_qbs": {
    "away": "00-0036264",
    "home": "00-0039918"
  },
  "surface": "grass",
  "team_stats": {
    "CHI": {
      "passing_epa": 5.730147249812788,
      "passing_tds": 2,
      "passing_yards": 250,
      "receiving_epa": 10.608980069783572,
      "rushing_epa": 0.3080464271479286,
      "rushing_tds": 0,
      "rushing_yards": 150
    },
    "GB": {
      "passing_epa": 7.63952754362863,
      "passing_tds": 1,
      "passing_yards": 198,
      "receiving_epa": 8.949475933047054,
      "rushing_epa": -3.499362390488386,
      "rushing_tds": 0,
      "rushing_yards": 192
    }
  },
  "temp": 37,
  "total_line": 45.5,
  "week": 16,
  "wind": 6
}
