{
  "away_score": 15,
  "away_team": "ARI",
  "div_game": true,
  "game_id": "2025_03_ARI_SF",
  "home_score": 16,
  "home_team": "SF",
  "key_injuries": [
    {
      "gsis_id": "00-0034346",
      "name": "Will Hernandez",
      "primary_injury": "Knee",
      "status": "Questionable",
      "team": "ARI"
    },
    {
      "gsis_id": "00-0038540",
      "name": "Paris Johnson Jr.",
      "primary_injury": "Knee",
      "status": "Questionable",
      "team": "ARI"
    },
    {
      "gsis_id": "00-0039737",
      "name": "Tip Reiman",
      "primary_injury": "Foot",
      "status": "Questionable",
      "team": "ARI"
    },
    {
      "gsis_id": "00-0039807",
      "name": "Max Melton",
      "primary_injury": "Knee",
      "status": "Questionable",
      "team": "ARI"
    },
    {
      "gsis_id": "00-0040751",
      "name": "Will Johnson",
      "primary_injury": "Groin",
      "status": "Doubtful",
      "team": "ARI"
    },
    {
      "gsis_id": "00-0036259",
      "name": "Jauan Jennings",
      "primary_injury": "Ankle",
      "status": "Questionable",
      "team": "SF"
    },
    {
      "gsis_id": "00-0037829",
      "name": "Spencer Burford",
      "primary_injury": "Knee",
      "status": "Out",
      "team": "SF"
    },
    {
      "gsis_id": "00-0037834",
      "name": "Brock Purdy",
      "primary_injury": "Shoulder",
      "status": "Questionable",
      "team": "SF"
    },
    {
      "gsis_id": "00-0040172",
      "name": "Jordan Watkins",
      "primary_injury": "Calf",
      "status": "Out",
      "team": "SF"
    },
    {
      "gsis_id": "00-0040245",
      "name": "Connor Colby",
      "primary_injury": "Groin",
      "status": "Questionable",
      "team": "SF"
    }
  ],
  "kickoff": "16:25",
  "rest_days": {
    "away": 7,
    "home": 7
  },
  "result": 1,
  "roof": "outdoors",
  "season": 2025,
  "spread_line": 1.5,
  "stadium": "Levi's Stadium",
  "stadium_id": "SFO01",
  "starting_qbs": {
    "away": "00-0035228",
    "home": "00-0036972"
  },
  "surface": "grass",
  "team_stats": {
    "ARI": {
      "passing_epa": -0.6186131590061501,
      "passing_tds": 1,
      "passing_yards": 159,
      "receiving_epa": 2.002655035599213,
      "rushing_epa": -0.08796402605366893,
      "rushing_tds": 0,
      "rushing_yards": 106
    },
    "SF": {
      "passing_epa": 1.5022151318471164,
      "passing_tds": 1,
      "passing_yards": 284,
      "receiving_epa": 4.468624763881017,
      "rushing_epa": -4.746350501456151,
      "rushing_tds": 0,
      "rushing_yards": 73
    }
  },
  "temp": 72,
  "total_line": 44.5,
  "week": 3,
  "wind": 7
}
