{
  "away_score": 34,
  "away_team": "MIN",
  "div_game": false,
  "game_id": "2025_15_MIN_DAL",
  "home_score": 26,
  "home_team": "DAL",
  "key_injuries": [
    {
      "gsis_id": "00-0031364",
      "name": "Jadeveon Clowney",
      "primary_injury": "Hamstring",
      "status": "Questionable",
      "team": "DAL"
    },
    {
      "gsis_id": "00-0036361",
      "name": "Trevon Diggs",
      "primary_injury": "Knee",
      "status": "Questionable",
      "team": "DAL"
    },
    {
      "gsis_id": "00-0038041",
      "name": "Jake Ferguson",
      "primary_injury": "Calf",
      "status": "Questionable",
      "team": "DAL"
    },
    {
      "gsis_id": "00-0039341",
      "name": "Tyler Guyton",
      "primary_injury": "Ankle",
      "status": "Out",
      "team": "DAL"
    },
    {
      "gsis_id": "00-0036616",
      "name": "Christian Darrisaw",
      "primary_injury": "Knee",
      "status": "Questionable",
      "team": "MIN"
    },
    {
      "gsis_id": "00-0037276",
      "name": "Ty Chandler",
      "primary_injury": "Knee",
      "status": "Questionable",
      "team": "MIN"
    }
  ],
  "kickoff": "20:20",
  "rest_days": {
    "away": 7,
    "home": 10
  },
  "result": -8,
  "roof": "closed",
  "season": 2025,
  "spread_line": 5.5,
  "stadium": "AT&T Stadium",
  "stadium_id": "DAL00",
  "starting_qbs": {
    "away": "00-0039923",
    "home": "00-0033077"
  },
  "surface": "matrixturf",
  "team_stats": {
    "DAL": {
      "passing_epa": 0.9589329863363227,
      "passing_tds": 0,
      "passing_yards": 294,
      "receiving_epa": 6.155552569277973,
      "rushing_epa": 6.7209679124935064,
      "rushing_tds": 2,
      "rushing_yards": 138
    },
    "MIN": {
      "passing_epa": 12.018167156590202,
      "passing_tds": 2,
      "passing_yards": 250,
      "receiving_epa": 12.018167156590202,
      "rushing_epa": -1.5916756133990884,
      "rushing_tds": 2,
      "rushing_yards": 77
    }
  },
  "temp": null,
  "total_line": 47.5,
  "week": 15,
  "wind": null
}
