{
  "away_score": 14,
  "away_team": "NO",
  "div_game": false,
  "game_id": "2025_07_NO_CHI",
  "home_score": 26,
  "home_team": "CHI",
  "key_injuries": [
    {
      "gsis_id": "00-0031203",
      "name": "Cairo Santos",
      "primary_injury": "Thigh",
      "status": "Out",
      "team": "CHI"
    },
    {
      "gsis_id": "00-0031583",
      "name": "Grady Jarrett",
      "primary_injury": "Knee",
      "status": "Questionable",
      "team": "CHI"
    },
    {
      "gsis_id": "00-0035594",
      "name": "Travis Homer",
      "primary_injury": "Calf",
      "status": "Questionable",
      "team": "CHI"
    },
    {
      "gsis_id": "00-0036275",
      "name": "D'Andre Swift",
      "primary_injury": "Groin",
      "status": "Questionable",
      "team": "CHI"
    },
    {
      "gsis_id": "00-0036716",
      "name": "Amen Ogbongbemiga",
      "primary_injury": "Knee",
      "status": "Questionable",
      "team": "CHI"
    },
    {
      "gsis_id": "00-0038390",
      "name": "Noah Sewell",
      "primary_injury": "Concussion",
      "status": "Out",
      "team": "CHI"
    },
    {
      "gsis_id": "00-0039840",
      "name": "Austin Booker",
      "primary_injury": "Knee",
      "status": "Questionable",
      "team": "CHI"
    },
    {
      "gsis_id": "00-0034780",
      "name": "Isaac Yiadom",
      "primary_injury": "Hamstring",
      "status": "Questionable",
      "team": "NO"
    },
    {
      "gsis_id": "00-0037283",
      "name": "John Ridgeway",
      "primary_injury": "Shoulder",
      "status": "Out",
      "team": "NO"
    }
  ],
  "kickoff": "13:00",
  "rest_days": {
    "away": 7,
    "home": 6
  },
  "result": 12,
  "roof": "outdoors",
  "season": 2025,
  "spread_line": 4.5,
  "stadium": "Soldier Field",
  "stadium_id": "CHI98",
  "starting_qbs": {
    "away": "00-0039376",
    "home": "00-0039918"
  },
  "surface": "grass",
  "team_stats": {
    "CHI": {
      "passing_epa": 2.149814817582892,
      "passing_tds": 0,
      "passing_yards": 172,
      "receiving_epa": 5.290478702430846,
      "rushing_epa": 0.5681171632757938,
      "rushing_tds": 2,
      "rushing_yards": 222
    },
    "NO": {
      "passing_epa": -12.238946060688937,
      "passing_tds": 2,
      "passing_yards": 233,
      "receiving_epa": -2.2419104020034473,
      "rushing_epa": -3.4923759896773845,
      "rushing_tds": 0,
      "rushing_yards": 44
    }
  },
  "temp": 49,
  "total_line": 43.5,
  "week": 7,
  "wind": 8
}
