{
  "away_score": 27,
  "away_team": "MIN",
  "div_game": true,
  "game_id": "2025_09_MIN_DET",
  "home_score": 24,
  "home_team": "DET",
  "key_injuries": [
    {
      "gsis_id": "00-0032381",
      "name": "Taylor Decker",
      "primary_injury": "Shoulder",
      "status": "Questionable",
      "team": "DET"
    },
    {
      "gsis_id": "00-0034377",
      "name": "Avonte Maddox",
      "primary_injury": "Hamstring",
      "status": "Questionable",
      "team": "DET"
    },
    {
      "gsis_id": "00-0035567",
      "name": "Craig Reynolds",
      "primary_injury": "Hamstring",
      "status": "Out",
      "team": "DET"
    },
    {
      "gsis_id": "00-0036306",
      "name": "Daniel Thomas",
      "primary_injury": "Forearm",
      "status": "Out",
      "team": "DET"
    },
    {
      "gsis_id": "00-0037289",
      "name": "Malcolm Rodriguez",
      "primary_injury": "Knee",
      "status": "Out",
      "team": "DET"
    },
    {
      "gsis_id": "00-0037667",
      "name": "Kerby Joseph",
      "primary_injury": "Knee",
      "status": "Out",
      "team": "DET"
    },
    {
      "gsis_id": "00-0039364",
      "name": "Sione Vaki",
      "primary_injury": "Groin",
      "status": "Questionable",
      "team": "DET"
    },
    {
      "gsis_id": "00-0032918",
      "name": "C.J. Ham",
      "primary_injury": "Hand",
      "status": "Out",
      "team": "MIN"
    },
    {
      "gsis_id": "00-0034158",
      "name": "Brian O'Neill",
      "primary_injury": "Knee",
      "status": "Questionable",
      "team": "MIN"
    },
    {
      "gsis_id": "00-0035249",
      "name": "Josh Oliver",
      "primary_injury": "Foot",
      "status": "Out",
      "team": "MIN"
    },
    {
      "gsis_id": "00-0035272",
      "name": "Andrew Van Ginkel",
      "primary_injury": "Neck",
      "status": "Questionable",
      "team": "MIN"
    },
    {
      "gsis_id": "00-0036274",
      "name": "Jeff Okudah",
      "primary_injury": "Concussion",
      "status": "Out",
      "team": "MIN"
    },
    {
      "gsis_id": "00-0036348",
      "name": "Josh Metellus",
      "primary_injury": "Foot",
      "status": "Questionable",
      "team": "MIN"
    },
    {
      "gsis_id": "00-0036616",
      "name": "Christian Darrisaw",
      "primary_injury": "Knee",
      "status": "Questionable",
      "team": "MIN"
    }
  ],
  "kickoff": "13:00",
  "rest_days": {
    "away": 10,
    "home": 13
  },
  "result": -3,
  "roof": "dome",
  "season": 2025,
  "spread_line": 9.5,
  "stadium": "Ford Field",
  "stadium_id": "DET00",
  "starting_qbs": {
    "away": "00-0039923",
    "home": "00-0033106"
  },
  "surface": "fieldturf",
  "team_stats": {
    "DET": {
      "passing_epa": 4.1288096063833954,
      "passing_tds": 2,
      "passing_yards": 284,
      "receiving_epa": 14.93261122860713,
      "rushing_epa": -4.567611917620525,
      "rushing_tds": 1,
      "rushing_yards": 65
    },
    "MIN": {
      "passing_epa": -7.4183446173490415,
      "passing_tds": 2,
      "passing_yards": 143,
      "receiving_epa": 2.133573774830438,
      "rushing_epa": 6.234363409690559,
      "rushing_tds": 1,
      "rushing_yards": 142
    }
  },
  "temp": null,
  "total_line": 47.5,
  "week": 9,
  "wind": null
}
