{
  "away_score": 32,
  "away_team": "NYG",
  "div_game": false,
  "game_id": "2025_07_NYG_DEN",
  "home_score": 33,
  "home_team": "DEN",
  "key_injuries": [
    {
      "gsis_id": "00-0034982",
      "name": "Dre Greenlaw",
      "primary_injury": "Quadricep",
      "status": "Questionable",
      "team": "DEN"
    },
    {
      "gsis_id": "00-0039809",
      "name": "Jonah Elliss",
      "primary_injury": "Shoulder",
      "status": "Out",
      "team": "DEN"
    },
    {
      "gsis_id": "00-0035020",
      "name": "Demetrius Flannigan-Fowles",
      "primary_injury": "Hamstring",
      "status": "Out",
      "team": "NYG"
    },
    {
      "gsis_id": "00-0035535",
      "name": "Darius Slayton",
      "primary_injury": "Hamstring",
      "status": "Out",
      "team": "NYG"
    },
    {
      "gsis_id": "00-0036896",
      "name": "Victor Dimukeje",
      "primary_injury": "Pectoral",
      "status": "Questionable",
      "team": "NYG"
    },
    {
      "gsis_id": "00-0036982",
      "name": "Chauncey Golston",
      "primary_injury": "Neck",
      "status": "Out",
      "team": "NYG"
    },
    {
      "gsis_id": "00-0039019",
      "name": "John Michael Schmitz",
      "primary_injury": "Concussion",
      "status": "Out",
      "team": "NYG"
    },
    {
      "gsis_id": "00-0039313",
      "name": "Swayze Bozeman",
      "primary_injury": "Ankle",
      "status": "Out",
      "team": "NYG"
    },
    {
      "gsis_id": "00-0040677",
      "name": "Abdul Carter",
      "primary_injury": "Hamstring",
      "status": "Questionable",
      "team": "NYG"
    }
  ],
  "kickoff": "16:05",
  "rest_days": {
    "away": 10,
    "home": 7
  },
  "result": 1,
  "roof": "outdoors",
  "season": 2025,
  "spread_line": 7.5,
  "stadium": "Empower Field at Mile High",
  "stadium_id": "DEN00",
  "starting_qbs": {
    "away": "00-0040691",
    "home": "00-0039732"
  },
  "surface": "grass",
  "team_stats": {
    "DEN": {
      "passing_epa": -1.4068489084650624,
      "passing_tds": 2,
      "passing_yards": 279,
      "receiving_epa": -0.1952424648040907,
      "rushing_epa": 8.40782054932788,
      "rushing_tds": 2,
      "rushing_yards": 142
    },
    "NYG": {
      "passing_epa": 8.377084178893828,
      "passing_tds": 3,
      "passing_yards": 283,
      "receiving_epa": 12.801825958289673,
      "rushing_epa": 0.21420120215043426,
      "rushing_tds": 2,
      "rushing_yards": 119
    }
  },
  "temp": 72,
  "total_line": 39.5,
  "week": 7,
  "wind": 3
}
