{
  "away_score": 41,
  "away_team": "IND",
  "div_game": true,
  "game_id": "2025_03_IND_TEN",
  "home_score": 20,
  "home_team": "TEN",
  "key_injuries": [
    {
      "gsis_id": "00-0034573",
      "name": "Charvarius Ward",
      "primary_injury": "Concussion",
      "status": "Questionable",
      "team": "IND"
    },
    {
      "gsis_id": "00-0040128",
      "name": "Tyler Warren",
      "primary_injury": "Toe",
      "status": "Questionable",
      "team": "IND"
    },
    {
      "gsis_id": "00-0029592",
      "name": "Kevin Zeitler",
      "primary_injury": "Biceps",
      "status": "Questionable",
      "team": "TEN"
    },
    {
      "gsis_id": "00-0036374",
      "name": "L'Jarius Sneed",
      "primary_injury": "Back",
      "status": "Questionable",
      "team": "TEN"
    },
    {
      "gsis_id": "00-0039372",
      "name": "Jarvis Brownlee Jr.",
      "primary_injury": "Ankle",
      "status": "Questionable",
      "team": "TEN"
    },
    {
      "gsis_id": "00-0039650",
      "name": "Bryce Oliver",
      "primary_injury": "Knee",
      "status": "Questionable",
      "team": "TEN"
    },
    {
      "gsis_id": "00-0039731",
      "name": "JC Latham",
      "primary_injury": "Hip",
      "status": "Out",
      "team": "TEN"
    },
    {
      "gsis_id": "00-0039886",
      "name": "T'Vondre Sweat",
      "primary_injury": "Ankle",
      "status": "Out",
      "team": "TEN"
    },
    {
      "gsis_id": "00-0040141",
      "name": "Kevin Winston Jr.",
      "primary_injury": "Hamstring",
      "status": "Doubtful",
      "team": "TEN"
    },
    {
      "gsis_id": "00-0040205",
      "name": "Kalel Mullings",
      "primary_injury": "Ankle",
      "status": "Questionable",
      "team": "TEN"
    }
  ],
  "kickoff": "13:00",
  "rest_days": {
    "away": 7,
    "home": 7
  },
  "result": -21,
  "roof": "outdoors",
  "season": 2025,
  "spread_line": -6.0,
  "stadium": "Nissan Stadium",
  "stadium_id": "NAS00",
  "starting_qbs": {
    "away": "00-0035710",
    "home": "00-0040676"
  },
  "surface": "grass",
  "team_stats": {
    "IND": {
      "passing_epa": 10.818640147236174,
      "passing_tds": 1,
      "passing_yards": 228,
      "receiving_epa": 10.818640147236174,
      "rushing_epa": 4.743311626029598,
      "rushing_tds": 3,
      "rushing_yards": 137
    },
    "TEN": {
      "passing_epa": -12.524410886228843,
      "passing_tds": 1,
      "passing_yards": 219,
      "receiving_epa": -2.184083973760543,
      "rushing_epa": 1.3147960329661146,
      "rushing_tds": 1,
      "rushing_yards": 86
    }
  },
  "temp": 84,
  "total_line": 43.5,
  "week": 3,
  "wind": 8
}
