{
  "away_score": 28,
  "away_team": "PIT",
  "div_game": false,
  "game_id": "2025_12_PIT_CHI",
  "home_score": 31,
  "home_team": "CHI",
  "key_injuries": [
    {
      "gsis_id": "00-0034673",
      "name": "Tremaine Edmunds",
      "primary_injury": "Groin",
      "status": "Out",
      "team": "CHI"
    },
    {
      "gsis_id": "00-0035386",
      "name": "T.J. Edwards",
      "primary_injury": "Hand",
      "status": "Out",
      "team": "CHI"
    },
    {
      "gsis_id": "00-0035594",
      "name": "Travis Homer",
      "primary_injury": "Hamstring",
      "status": "Out",
      "team": "CHI"
    },
    {
      "gsis_id": "00-0036292",
      "name": "Jaylon Johnson",
      "primary_injury": "Groin",
      "status": "Questionable",
      "team": "CHI"
    },
    {
      "gsis_id": "00-0038111",
      "name": "Kyler Gordon",
      "primary_injury": "Calf",
      "status": "Questionable",
      "team": "CHI"
    },
    {
      "gsis_id": "00-0038135",
      "name": "Jaquan Brisker",
      "primary_injury": "Shoulder",
      "status": "Questionable",
      "team": "CHI"
    },
    {
      "gsis_id": "00-0038390",
      "name": "Noah Sewell",
      "primary_injury": "Elbow",
      "status": "Out",
      "team": "CHI"
    },
    {
      "gsis_id": "00-0039021",
      "name": "Roschon Johnson",
      "primary_injury": "Thumb",
      "status": "Out",
      "team": "CHI"
    },
    {
      "gsis_id": "00-0039459",
      "name": "Theo Benedet",
      "primary_injury": "Quadricep",
      "status": "Questionable",
      "team": "CHI"
    },
    {
      "gsis_id": "00-0023459",
      "name": "Aaron Rodgers",
      "primary_injury": "Wrist",
      "status": "Questionable",
      "team": "PIT"
    },
    {
      "gsis_id": "00-0027969",
      "name": "Cameron Heyward",
      "primary_injury": "Not injury related - resting player",
      "status": "Questionable",
      "team": "PIT"
    },
    {
      "gsis_id": "00-0030062",
      "name": "Darius Slay",
      "primary_injury": "Concussion",
      "status": "Questionable",
      "team": "PIT"
    },
    {
      "gsis_id": "00-0036333",
      "name": "Alex Highsmith",
      "primary_injury": "Pectoral",
      "status": "Doubtful",
      "team": "PIT"
    }
  ],
  "kickoff": "13:00",
  "rest_days": {
    "away": 7,
    "home": 7
  },
  "result": 3,
  "roof": "outdoors",
  "season": 2025,
  "spread_line": 3.0,
  "stadium": "Soldier Field",
  "stadium_id": "CHI98",
  "starting_qbs": {
    "away": "00-0034771",
    "home": "00-0039918"
  },
  "surface": "grass",
  "team_stats": {
    "CHI": {
      "passing_epa": 0.5364274792325929,
      "passing_tds": 3,
      "passing_yards": 239,
      "receiving_epa": 8.764461047074292,
      "rushing_epa": 0.2606248884694651,
      "rushing_tds": 1,
      "rushing_yards": 99
    },
    "PIT": {
      "passing_epa": -5.817271571839228,
      "passing_tds": 1,
      "passing_yards": 171,
      "receiving_epa": 0.6474908059462905,
      "rushing_epa": 5.889781014062464,
      "rushing_tds": 2,
      "rushing_yards": 186
    }
  },
  "temp": 51,
  "total_line": 46.5,
  "week": 12,
  "wind": 3
}
