{
  "away_score": 27,
  "away_team": "NYJ",
  "div_game": false,
  "game_id": "2025_03_NYJ_TB",
  "home_score": 29,
  "home_team": "TB",
  "key_injuries": [
    {
      "gsis_id": "00-0033943",
      "name": "Josh Reynolds",
      "primary_injury": "Hamstring",
      "status": "Out",
      "team": "NYJ"
    },
    {
      "gsis_id": "00-0036501",
      "name": "Michael Carter II",
      "primary_injury": "Shoulder",
      "status": "Questionable",
      "team": "NYJ"
    },
    {
      "gsis_id": "00-0036842",
      "name": "Kene Nwangwu",
      "primary_injury": "Hamstring",
      "status": "Out",
      "team": "NYJ"
    },
    {
      "gsis_id": "00-0036881",
      "name": "Jay Tufele",
      "primary_injury": "Illness",
      "status": "Out",
      "team": "NYJ"
    },
    {
      "gsis_id": "00-0036945",
      "name": "Justin Fields",
      "primary_injury": "Concussion",
      "status": "Out",
      "team": "NYJ"
    },
    {
      "gsis_id": "00-0037155",
      "name": "Tony Adams",
      "primary_injury": "Hip",
      "status": "Questionable",
      "team": "NYJ"
    },
    {
      "gsis_id": "00-0037526",
      "name": "Marcelino McCrary-Ball",
      "primary_injury": "Hamstring",
      "status": "Questionable",
      "team": "NYJ"
    },
    {
      "gsis_id": "00-0037663",
      "name": "Jermaine Johnson II",
      "primary_injury": "Ankle",
      "status": "Out",
      "team": "NYJ"
    },
    {
      "gsis_id": "00-0033921",
      "name": "Chris Godwin Jr.",
      "primary_injury": "Ankle",
      "status": "Out",
      "team": "TB"
    },
    {
      "gsis_id": "00-0036406",
      "name": "Tristan Wirfs",
      "primary_injury": "Knee",
      "status": "Out",
      "team": "TB"
    },
    {
      "gsis_id": "00-0040129",
      "name": "Emeka Egbuka",
      "primary_injury": "Hip",
      "status": "Questionable",
      "team": "TB"
    }
  ],
  "kickoff": "13:00",
  "rest_days": {
    "away": 7,
    "home": 6
  },
  "result": 2,
  "roof": "outdoors",
  "season": 2025,
  "spread_line": 6.5,
  "stadium": "Raymond James Stadium",
  "stadium_id": "TAM00",
  "starting_qbs": {
    "away": "00-0028118",
    "home": "00-0034855"
  },
  "surface": "grass",
  "team_stats": {
    "NYJ": {
      "passing_epa": -7.886901567328738,
      "passing_tds": 2,
      "passing_yards": 197,
      "receiving_epa": -0.4157031605015673,
      "rushing_epa": -3.53839694254566,
      "rushing_tds": 0,
      "rushing_yards": 99
    },
    "TB": {
      "passing_epa": 8.269022356935064,
      "passing_tds": 1,
      "passing_yards": 233,
      "receiving_epa": 9.824077634124304,
      "rushing_epa": -6.91463324007844,
      "rushing_tds": 0,
      "rushing_yards": 122
    }
  },
  "temp": 88,
  "total_line": 43.5,
  "week": 3,
  "wind": 5
}
