{
  "away_score": 27,
  "away_team": "JAX",
  "div_game": false,
  "game_id": "2025_02_JAX_CIN",
  "home_score": 31,
  "home_team": "CIN",
  "key_injuries": [
    {
      "gsis_id": "00-0037313",
      "name": "Montaric Brown",
      "primary_injury": "Ankle",
      "status": "Doubtful",
      "team": "JAX"
    },
    {
      "gsis_id": "00-0040146",
      "name": "Wyatt Milum",
      "primary_injury": "Knee",
      "status": "Out",
      "team": "JAX"
    }
  ],
  "kickoff": "13:00",
  "rest_days": {
    "away": 7,
    "home": 7
  },
  "result": 4,
  "roof": "outdoors",
  "season": 2025,
  "spread_line": 3.5,
  "stadium": "Paycor Stadium",
  "stadium_id": "CIN00",
  "starting_qbs": {
    "away": "00-0036971",
    "home": "00-0036442"
  },
  "surface": "fieldturf",
  "team_stats": {
    "CIN": {
      "passing_epa": -1.8282178881594828,
      "passing_tds": 3,
      "passing_yards": 317,
      "receiving_epa": 3.907746543850013,
      "rushing_epa": 1.3624283743847627,
      "rushing_tds": 1,
      "rushing_yards": 48
    },
    "JAX": {
      "passing_epa": 5.005488552057198,
      "passing_tds": 3,
      "passing_yards": 271,
      "receiving_epa": 5.674372815576628,
      "rushing_epa": 1.5001768789282717,
      "rushing_tds": 0,
      "rushing_yards": 139
    }
  },
  "temp": 85,
  "total_line": 49.5,
  "week": 2,
  "wind": 3
}
